{
    "experimentId":  "EXP-028",
    "caseId":  "CASE-028",
    "caseVersion":  "CASE-028-v1",
    "category":  "COLLECTION",
    "endpoint":  "/books/by-author/{authorId}",
    "httpMethod":  "GET",
    "snapshotTarget":  "BookApiIntegrationTest.testGetBooksByAuthor_Snapshot.approved.txt",
    "testTarget":  "BookApiIntegrationTest.testGetBooksByAuthor_Snapshot",
    "mutationPoints":  [
                           "MP-017"
                       ],
    "difficulty":  "MEDIUM",
    "expectedScope":  "TARGET_ONLY",
    "baselineCommit":  "8316d9ffa0c109c0aac68fd181b94fdd9dce368e",
    "catalogFreezeCommit":  "3a30d6154bafc230db0b83c8872b7fe79aeba420",
    "approvedSha256":  "7FD5C171DB022F6B359EA46F3EC0B62EE84C270759D9BFB0BDCE9AA4A000B849",
    "receivedSha256":  "113A05B889760D46FA46D0C820159B85B65B4CDB8599B290E269BCDC5BD28390",
    "patchSha256":  "285136092661E3221AD0338B262F97A5F76785B6B7819F130E3F6DF5B5843114",
    "testOutputSha256":  "A6B13629AE45106D6F9C60A34AF7AE46B2C0AD0FF1AA05B9F37F3431212A0082",
    "reproducible":  true,
    "state":  "VALIDATED"
}
